{
  "schemaVersion": 1,
  "id": "media",
  "version": "2.0.0",
  "compatibility": ">=2.0.0,<3.0.0",
  "models": [
    "media.asset",
    "media.object-version",
    "media.variant",
    "media.upload-session",
    "media.metadata-revision",
    "media.collection",
    "media.reference",
    "media.job",
    "media.retention-hold"
  ],
  "migrations": [
    "django/sitecontent/migrations/0011_universal_media_library.py",
    "django/sitecontent/migrations/0012_universal_media_library_roles.py"
  ],
  "apiRoutes": ["/api/media/v1"],
  "uiRoutes": ["/media"],
  "navigation": ["media.library"],
  "permissions": [
    "media.read",
    "media.upload",
    "media.write",
    "media.publish",
    "media.archive",
    "media.delete",
    "media.audit",
    "media.policy"
  ],
  "jobs": [
    "media.inspect",
    "media.derive",
    "media.reconcile",
    "media.export",
    "media.expire",
    "media.purge"
  ],
  "settingsSchema": "modules/media/settings.schema.json",
  "healthChecks": ["media.storage-ready", "media.scanner-ready", "media.worker-ready"],
  "providerCapabilities": ["storage"],
  "dependencies": ["content-workspace"],
  "dataLifecycle": { "disable": "preserve", "export": true, "remove": "backup-required" }
}
